{
  "id": "CT-SUP-07",
  "titulo": "Infraestrutura compatível com os componentes formativos",
  "dominio": "suporte",
  "criticidade": "OBRIG",
  "secoes_preferenciais": [
    "infraestrutura"
  ],
  "consultas": [
    "infraestrutura",
    "infraestrutura mínima",
    "laboratório",
    "biblioteca",
    "acervo",
    "espaços",
    "contexto_estrutural.cnct.comparacao_catalogo.correspondencia.infraestrutura_minima"
  ],
  "referencias_normativas": [],
  "pergunta": "A infraestrutura descrita é compatível, em nível institucional, com a execução da proposta curricular e com a infraestrutura mínima indicada no CNCT?",
  "rubrica": "Comparar laboratórios, biblioteca, acervo e espaços de aprendizagem descritos no PPC com `contexto_estrutural.cnct.comparacao_catalogo.correspondencia.infraestrutura_minima`, avaliando aderência à oferta e aos componentes práticos.",
  "boa_evidencia": "Seção de infraestrutura com ambientes identificáveis, aderentes ao curso e compatíveis com o campo `Infraestrutura Mínima` do CNCT.",
  "ma_evidencia": "Infraestrutura genérica, desconectada do curso, sem menção a laboratórios centrais ou inferior à infraestrutura mínima CNCT.",
  "escalonar_quando": "Escalonar se a infraestrutura for parcialmente descrita, sem vínculo claro com componentes práticos ou sem correspondência observável com os ambientes mínimos do CNCT.",
  "evidencia_minima": 2,
  "estados_permitidos": [
    "ATENDE",
    "NAO_ATENDE",
    "INCONCLUSIVO",
    "NAO_APLICAVEL"
  ]
}
